[
  {
    "契约版本": "训练提醒偏好.v1",
    "成员ID": 1001,
    "提醒类型": "训练计划",
    "提醒渠道": ["应用内"],
    "提前时间分钟": 60,
    "免打扰时段": {
      "启用": false,
      "开始时间": null,
      "结束时间": null,
      "时区": "Asia/Shanghai"
    },
    "训练日例外": [],
    "是否启用": true,
    "更新时间": "2026-06-06T10:00:00+08:00"
  },
  {
    "契约版本": "训练提醒偏好.v1",
    "成员ID": 1002,
    "提醒类型": "活动报名",
    "提醒渠道": ["应用内", "短信"],
    "提前时间分钟": 120,
    "免打扰时段": {
      "启用": false,
      "开始时间": null,
      "结束时间": null,
      "时区": "Asia/Shanghai"
    },
    "训练日例外": [],
    "是否启用": true,
    "更新时间": "2026-06-06T10:10:00+08:00"
  },
  {
    "契约版本": "训练提醒偏好.v1",
    "成员ID": 1003,
    "提醒类型": "异常复盘",
    "提醒渠道": ["应用内", "微信"],
    "提前时间分钟": 0,
    "免打扰时段": {
      "启用": true,
      "开始时间": "22:30",
      "结束时间": "07:30",
      "时区": "Asia/Shanghai"
    },
    "训练日例外": [
      {
        "日期": "2026-06-08",
        "处理方式": "仅应用内",
        "原因": "考试周不接收外部提醒"
      },
      {
        "日期": "2026-06-15",
        "处理方式": "暂停提醒",
        "原因": "请假休息"
      }
    ],
    "是否启用": true,
    "更新时间": "2026-06-06T10:20:00+08:00"
  }
]
